{
  "$schema": "../change-request.schema.json",
  "schema": "change_request.v1",
  "id": "add-run-inspection",
  "objective": "Add a `daemar runs` command that prints recent Workflow Runs with their terminal outcomes, reading the Run Records under .daemar/runs/ without modifying them.",
  "acceptance_criteria": [
    "Running `daemar runs` prints one line per Run Record, newest first, showing the run ID and terminal outcome.",
    "Running the command in a repository with no runs prints a clear empty message and exits zero.",
    "The command performs no writes: .daemar/runs/ is byte-identical before and after."
  ]
}
